{
    "id": "core.channels.telegram",
    "name": "Telegram Channel",
    "tagline": "Chat with your BFrost assistant from Telegram — text, voice notes, and photos all work.",
    "description": "Built-in channel adapter that connects your BFrost assistant to a Telegram bot. Once your bot token is configured, BFrost listens for messages and replies inline. Voice notes are transcribed automatically when Whisper is available.\n\nThis is a core infrastructure worker — it ships with every BFrost installation and cannot be removed.",
    "author": "@bfrost",
    "repoUrl": "https://github.com/ccascio/bfrost",
    "category": "Core / Channel",
    "tags": ["telegram", "channel", "messaging", "voice", "built-in", "core"],
    "trust": "Core",
    "latestVersion": "0.1.0",
    "bfrostEngine": ">=0.1.0",
    "license": "MIT",
    "builtIn": true,
    "createdAt": "2026-01-01T00:00:00Z",
    "updatedAt": "2026-05-24T00:00:00Z",
    "capabilities": {
        "jobs": [],
        "tools": [],
        "channels": ["telegram"],
        "providers": [],
        "itemProduces": [],
        "itemConsumes": []
    },
    "permissions": ["network:https", "operator-notify"],
    "downloadCount": 0,
    "versions": [
        {
            "version": "0.1.0",
            "bfrostEngine": ">=0.1.0",
            "releaseUrl": "https://github.com/ccascio/bfrost",
            "changelog": "Ships with BFrost. No standalone install needed.",
            "publishedAt": "2026-01-01T00:00:00Z",
            "yanked": false,
            "bundleSha256": "",
            "bundleSizeBytes": 0
        }
    ]
}
