{
  "id": "core.finance-analyst",
  "name": "Finance Analyst",
  "tagline": "Reads finance.news items and adds a structured, informational market-impact read.",
  "description": "A consumer worker that reads `finance.news` items from the BFrost Item Bus and attaches a structured analysis to each one: likely direction, magnitude, horizon, confidence, priced-in risk, and mechanism.\n\nIt is designed to run after Finance News Watch. Configure the schedule, model, investor lens, and prompt in Jobs, then inspect the latest reads and pending items in the worker dashboard. Informational only, never buy/sell/hold advice.",
  "author": "@ccascio",
  "repoUrl": "https://github.com/ccascio/bfrost-workers",
  "readmeUrl": "https://raw.githubusercontent.com/ccascio/bfrost-workers/main/packages/core.finance-analyst/README.md",
  "category": "AI / Research",
  "tags": [
    "finance",
    "analysis",
    "consumer",
    "item-bus",
    "local-first"
  ],
  "trust": "Community",
  "latestVersion": "0.1.0",
  "bfrostEngine": ">=0.3.0",
  "license": "MIT",
  "createdAt": "2026-05-29T15:00:00Z",
  "updatedAt": "2026-05-29T15:00:00Z",
  "capabilities": {
    "jobs": [
      "finance-analysis"
    ],
    "tools": [],
    "channels": [],
    "providers": [],
    "itemProduces": [],
    "itemConsumes": [
      "finance.news"
    ]
  },
  "permissions": [
    "storage:worker-kv"
  ],
  "downloadCount": 0,
  "versions": [
    {
      "version": "0.1.0",
      "bfrostEngine": ">=0.3.0",
      "releaseUrl": "https://github.com/ccascio/bfrost-workers/releases/tag/core.finance-analyst-v0.1.0",
      "bundleUrl": "https://github.com/ccascio/bfrost-workers/releases/download/core.finance-analyst-v0.1.0/core.finance-analyst.tar.gz",
      "changelog": "Initial source-backed release with finance.news consumption, structured informational reads, optional notifications, dashboard output review, and low-code guidance.",
      "publishedAt": "2026-05-29T15:00:00Z",
      "yanked": false,
      "bundleSha256": "ec9e487680c0158b90eadeddf3841f1f5b390ac83ec8b53a893f1dd24231766a",
      "bundleSizeBytes": 8288
    }
  ]
}
