{
    "id": "core.items.query",
    "name": "Bus & History Inspector",
    "tagline": "Lets the assistant look up what is in your queue, search past items, and summarise recent runs — just ask.",
    "description": "Built-in tool worker that exposes Item Bus queries and run history to the BFrost assistant. Use natural language to ask what news articles are queued, look up recent research notes, or check how a job performed last week.\n\nThis is a core infrastructure worker — it ships with every BFrost installation and cannot be removed.",
    "author": "@bfrost",
    "repoUrl": "https://github.com/ccascio/bfrost",
    "category": "Core / Tool",
    "tags": ["items", "queue", "history", "tools", "assistant", "built-in", "core"],
    "trust": "Core",
    "latestVersion": "0.1.0",
    "bfrostEngine": ">=0.1.0",
    "license": "MIT",
    "builtIn": true,
    "createdAt": "2026-01-01T00:00:00Z",
    "updatedAt": "2026-05-24T00:00:00Z",
    "capabilities": {
        "jobs": [],
        "tools": ["queryItems", "recentRuns"],
        "channels": [],
        "providers": [],
        "itemProduces": [],
        "itemConsumes": []
    },
    "permissions": ["storage:worker-kv"],
    "downloadCount": 0,
    "versions": [
        {
            "version": "0.1.0",
            "bfrostEngine": ">=0.1.0",
            "releaseUrl": "https://github.com/ccascio/bfrost",
            "changelog": "Ships with BFrost. No standalone install needed.",
            "publishedAt": "2026-01-01T00:00:00Z",
            "yanked": false,
            "bundleSha256": "",
            "bundleSizeBytes": 0
        }
    ]
}
