{
  "id": "markdown-notes-publisher",
  "name": "Markdown Notes Publisher",
  "tagline": "Saves, browses, uploads, previews, and semantically searches BFrost Markdown notes.",
  "description": "A consumer worker that turns selected Item Bus entries into local Markdown notes. It can save `news.article`, `research.paper`, `web.page`, `webhook.event`, or any configured item type into a folder chosen by the operator.\n\nThe worker is built for low-code use: choose a folder, select suggested item types, run a producer, then approve generated file-write actions. The dashboard can browse the notes folder, preview files as formatted Markdown or raw text, upload manual notes, index existing files, and search notes semantically with BFrost's selected embedding model.",
  "author": "@ccascio",
  "repoUrl": "https://github.com/ccascio/bfrost-workers",
  "readmeUrl": "https://raw.githubusercontent.com/ccascio/bfrost-workers/main/packages/markdown-notes-publisher/README.md",
  "category": "Productivity",
  "tags": [
    "markdown",
    "notes",
    "obsidian",
    "logseq",
    "joplin",
    "consumer",
    "local-first"
  ],
  "trust": "Community",
  "latestVersion": "0.2.0",
  "bfrostEngine": ">=0.3.0",
  "license": "MIT",
  "createdAt": "2026-05-28T08:00:00Z",
  "updatedAt": "2026-05-29T14:00:00Z",
  "capabilities": {
    "jobs": [
      "markdown-notes-write"
    ],
    "tools": [],
    "channels": [],
    "providers": [],
    "itemProduces": [],
    "itemConsumes": [
      "news.article",
      "research.paper",
      "web.page",
      "webhook.event"
    ]
  },
  "permissions": [
    "filesystem:scoped-read",
    "filesystem:scoped-write",
    "network:http",
    "network:https",
    "storage:worker-kv"
  ],
  "downloadCount": 0,
  "versions": [
    {
      "version": "0.2.0",
      "bfrostEngine": ">=0.3.0",
      "releaseUrl": "https://github.com/ccascio/bfrost-workers/releases/tag/markdown-notes-publisher-v0.2.0",
      "bundleUrl": "https://github.com/ccascio/bfrost-workers/releases/download/markdown-notes-publisher-v0.2.0/markdown-notes-publisher.tar.gz",
      "changelog": "Adds selectable Item Bus type suggestions, a notes-folder dashboard with formatted/raw previews and manual uploads, and semantic indexing/search using BFrost's selected embedding model.",
      "publishedAt": "2026-05-29T14:00:00Z",
      "yanked": false,
      "bundleSha256": "851eb94a454a6aff3f1a8421942db845f872ae224c4973313ef811b625a405bf",
      "bundleSizeBytes": 13501
    },
    {
      "version": "0.1.0",
      "bfrostEngine": ">=0.3.0",
      "releaseUrl": "https://github.com/ccascio/bfrost-workers/releases/tag/markdown-notes-publisher-v0.1.0",
      "bundleUrl": "https://github.com/ccascio/bfrost-workers/releases/download/markdown-notes-publisher-v0.1.0/markdown-notes-publisher.tar.gz",
      "changelog": "Initial source-backed release with folder settings, note templates, approval-backed file writes, dashboard view, and low-code README.",
      "publishedAt": "2026-05-28T08:00:00Z",
      "yanked": false,
      "bundleSha256": "b750d6d4fe5116050fbe28779a7b60f44cf7620ecf18901d40cc897ec4110c41",
      "bundleSizeBytes": 6954
    }
  ]
}
