{
    "id": "pr-review-digest",
    "name": "PR Review Digest",
    "tagline": "Summarizes open PRs, review state, blockers, and the next reviews to do.",
    "description": "Summarizes open pull requests, review status, blockers, and what needs attention.\n\nThis source-backed package includes the backend worker, dashboard bundle, Config surface, scheduled job manifest, and README. It connects to GitHub pull request API or compatible code-review export endpoints through operator-configured HTTPS source endpoints and bearer-token environment variables.",
    "author": "@ccascio",
    "repoUrl": "https://github.com/ccascio/bfrost-workers",
    "readmeUrl": "https://raw.githubusercontent.com/ccascio/bfrost-workers/main/packages/pr-review-digest/README.md",
    "category": "Developer Tools",
    "tags": [
        "github",
        "pull-requests",
        "review",
        "digest",
        "ci"
    ],
    "trust": "Review",
    "latestVersion": "0.1.0",
    "bfrostEngine": ">=0.3.0",
    "license": "MIT",
    "createdAt": "2026-06-01T00:00:00Z",
    "updatedAt": "2026-06-01T00:00:00Z",
    "capabilities": {
        "jobs": [
            "pr-review-digest"
        ],
        "tools": [],
        "channels": [],
        "providers": [],
        "itemProduces": [
            "dev.pr-review-digest"
        ],
        "itemConsumes": []
    },
    "permissions": [
        "network:https",
        "storage:worker-kv"
    ],
    "downloadCount": 0,
    "versions": [
        {
            "version": "0.1.0",
            "bfrostEngine": ">=0.3.0",
            "releaseUrl": "https://github.com/ccascio/bfrost-workers/releases/tag/v0.1.0",
            "bundleUrl": "https://github.com/ccascio/bfrost-workers/releases/download/v0.1.0/pr-review-digest.tar.gz",
            "changelog": "Initial source-backed worker package.",
            "publishedAt": "2026-06-01T00:00:00Z",
            "yanked": false,
            "bundleSha256": "105aaa9d4c98b2a76844a1972e29b09b63b27a2ce2fe37e89a5bc6a5430b38f3",
            "bundleSizeBytes": 9971
        }
    ]
}
