{
  "id": "mastodon-publisher",
  "name": "Mastodon Publisher",
  "tagline": "Posts news.article summaries to a Mastodon instance using the Mastodon API.",
  "description": "A consumer worker that reads `news.article` items from the BFrost Item Bus and posts each one as a toot to a configured Mastodon instance. Supports custom post templates, hashtag injection from article tags, and a 500-character truncation guard with a link appended.\n\nAuthenticate via an access token from your Mastodon instance's developer settings. The token is stored in BFrost's worker settings — never committed to source.",
  "author": "@alice",
  "repoUrl": "https://github.com/alice-dev/mastodon-publisher",
  "category": "Communication",
  "tags": ["mastodon", "fediverse", "social", "publisher", "consumer"],
  "trust": "Community",
  "latestVersion": "0.4.1",
  "bfrostEngine": ">=0.3.0",
  "license": "MIT",
  "createdAt": "2026-02-08T16:00:00Z",
  "updatedAt": "2026-05-01T11:20:00Z",
  "capabilities": {
    "jobs": ["mastodon-post"],
    "tools": [],
    "channels": [],
    "providers": [],
    "itemProduces": [],
    "itemConsumes": ["news.article"]
  },
  "permissions": ["network:https", "storage:worker-kv"],
  "downloadCount": 0,
  "versions": [
    {
      "version": "0.4.1",
      "bfrostEngine": ">=0.3.0",
      "releaseUrl": "https://github.com/alice-dev/mastodon-publisher/releases/tag/v0.4.1",
      "changelog": "Fix: truncation now respects Unicode code points, not byte length.",
      "publishedAt": "2026-05-01T11:20:00Z",
      "yanked": false,
      "bundleSha256": "",
      "bundleSizeBytes": 0
    },
    {
      "version": "0.4.0",
      "bfrostEngine": ">=0.3.0",
      "releaseUrl": "https://github.com/alice-dev/mastodon-publisher/releases/tag/v0.4.0",
      "changelog": "Added hashtag injection from article tags. Configurable max-hashtags limit.",
      "publishedAt": "2026-04-12T08:45:00Z",
      "yanked": false,
      "bundleSha256": "",
      "bundleSizeBytes": 0
    },
    {
      "version": "0.3.0",
      "bfrostEngine": ">=0.3.0",
      "releaseUrl": "https://github.com/alice-dev/mastodon-publisher/releases/tag/v0.3.0",
      "changelog": "Custom post templates via settings. URL append on truncation.",
      "publishedAt": "2026-03-22T14:00:00Z",
      "yanked": false,
      "bundleSha256": "",
      "bundleSizeBytes": 0
    },
    {
      "version": "0.2.0",
      "bfrostEngine": ">=0.3.0",
      "releaseUrl": "https://github.com/alice-dev/mastodon-publisher/releases/tag/v0.2.0",
      "changelog": "Initial public release.",
      "publishedAt": "2026-02-08T16:00:00Z",
      "yanked": false,
      "bundleSha256": "",
      "bundleSizeBytes": 0
    }
  ]
}
